{
  "vector_id": "request-valid-001",
  "saif_version": "0.3.0",
  "profile": "saif-reference-node/0.3",
  "area": "OBJECT",
  "target": "schemas/request.schema.json",
  "expected": "VALID",
  "description": "A submitted document request with all required fields.",
  "instance": {
    "id": "req_conformance_001",
    "type": "document_print",
    "created_at": "2026-08-08T09:10:00Z",
    "metadata": {},
    "agent_id": "agent_conformance_001",
    "status": "SUBMITTED",
    "requirement": {
      "document_ref": "document_conformance_001",
      "copies": 1
    }
  }
}
